<?xml version="1.0" encoding="UTF-8"?>

<DISsyntax
  xmlns:xsi="http://www.w3.org/2001/XMLSchema-instance"
  xsi:noNamespaceSchemaLocation="DISsyntax.xsd"
  title="DIS Syntax Laser PDU"
  release="0.3"
  date="2025-12-29"
  description="Laser PDU and associated records. Conforms to 1278.1-202X Draft 5 and SISO-REF-030 Version 1.0."
  organization="Simulation Interoperability Standards Organization">

  <copyright><![CDATA[
Copyright © 2025 by the Simulation Interoperability Standards Organization, Inc.
7901 4th St N, Suite 300-4043
St. Petersburg, FL 33702
All rights reserved.

Schema and API: SISO hereby grants a general, royalty-free license to copy, distribute, display, and
make derivative works from this material, for all purposes, provided that any use of the material
contains the following attribution: "Reprinted with permission from SISO Inc." Should
a reader require additional information, contact the SISO Inc. Board of Directors.

Documentation: SISO hereby grants a general, royalty-free license to copy, distribute,
display, and make derivative works from this material, for noncommercial purposes, provided that
any use of the material contains the following attribution: "Reprinted with permission from SISO Inc." 
The material may not be used for a commercial purpose without express written
permission from the SISO Inc Board of Directors.

SISO Inc. Board of Directors
7901 4th St N, Suite 300-4043
St. Petersburg, FL 33702
]]></copyright>

  <PDU name="Laser" PDUType="24" protocolFamily="6" baseLength="32">
    <FixedRecordField name="PDU Header" length="16" type="PDU Header"/>
    <FixedRecordField name="Lasing Entity ID" length="6" type="Entity Identifier"/>
    <NumericField name="Laser System Number" type="uint8"/>
    <NumericField name="Number of Beams" type="uint8"/>
    <EnumField name="Laser System Name" type="enum16" enumTableUID="80" />
    <BitRecordField name="Attributes" size="8" type="Laser Attributes"/>
    <NumericField name="Padding" type="uint8"/>
    <NumericField name="Padding" type="uint16"/>
    <ExtensionRecordSet>
      <CountField name="Number Of Extension Records" type="uint16"/>
      <ExtensionRecordFields/>
    </ExtensionRecordSet>
  </PDU>

  <BitRecord type="Laser Attributes" size="8">
    <BooleanBitField name="Permanently Associated" bitPosition="0"/>
    <BooleanBitField name="Location Provided" bitPosition="1"/>
    <IntBitField name="Padding" bitPosition="2" size="6"/>
  </BitRecord>

  <ExtensionRecord name="Laser Beam" recordTypeEnum="6500" baseLength="88" isVariable="false">
    <EnumField name="Record Type" type="enum16" enumTableUID="99"/>
    <NumericField name="Record Length" type="uint16"/>
    <NumericField name="Beam ID" type="uint8"/>
    <BitRecordField name="Beam Status" size="8" type="Beam Status"/>
    <NumericField name="Beam Parameter Index" type="uint16"/>
    <NumericField name="Beam Code" type="uint16"/>
    <EnumField name="Beam Function" type="enum8" enumTableUID="883"/>
    <EnumField name="Beam Shape" type="enum8" enumTableUID="881"/>
    <EnumField name="Flash Pattern" type="enum8" enumTableUID="884"/>
    <NumericField name="Padding" type="uint8"/>
    <NumericField name="Padding" type="uint16"/>
    <NumericField name="Power" type="float32" units="Watts"/>
    <NumericField name="Wavelength" type="float32" units="microns"/>
    <NumericField name="Pulse Repetition Frequency" type="float32" units="Hertz"/>
    <NumericField name="Pulse Width" type="float32" units="microseconds"/>
    <NumericField name="Beamwidth" type="float32" units="radians"/>
    <NumericField name="Aperture" type="float32" units="meters"/>
    <FixedRecordField name="Beam Spot Location" length="24" type="World Coordinates"/>
    <FixedRecordField name="Illuminated Object ID" length="6" type="Entity Identifier"/>
    <EnumField name="Spot Type" type="enum8" enumTableUID="882"/>
    <EnumField name="Motion Pattern" type="enum8" enumTableUID="880"/>
    <FixedRecordField name="Beam Spot Offset with Respect to Illuminated Object" length="12" type="Entity Coordinate Vector"/>
    <NumericField name="Padding" type="uint32"/>
  </ExtensionRecord>

</DISsyntax>
